{"commands":[{"arguments":[{"choices":[],"default":null,"help":"Target to inspect","kind":"positional","name":"target","required":true,"schema_version":1,"value_type":"string"}],"help":"Inspect local files","name":"inspect","schema_version":1}],"description":"An offline example","entrypoint":"example_tool:main","name":"example-tool","platforms":[{"arch":"x86_64","os":"linux"}],"python":{"maximum_exclusive":"3.15.0","minimum":"3.11.0"},"schema_version":1,"version":"1.0.0"}
